{"$schema":"https://json-schema.org/draft/2020-12/schema","title":"MockedWorkflowEvalCaseV1","type":"object","additionalProperties":false,"required":["schema_version","id","expected_tools","forbidden_tools","argument_constraints","expected_terminal_outcome"],"properties":{"schema_version":{"const":"1.0"},"id":{"type":"string"},"expected_tools":{"type":"array","items":{"type":"string"},"uniqueItems":true},"forbidden_tools":{"type":"array","items":{"type":"string"},"uniqueItems":true},"argument_constraints":{"type":"array","items":{"type":"object","additionalProperties":false,"required":["tool","path","operator","value"],"properties":{"tool":{"type":"string"},"path":{"type":"string"},"operator":{"enum":["equals","not_equals","contains","matches"]},"value":{}}}},"expected_terminal_outcome":{"type":"string"},"advisory_graders":{"type":"array","items":{"type":"string"}}}}
